,lemma,definition,detail,href
0,آخر,end,"آخر الأسبوع
ʔāḵer il-ʔusbūʕ
the weekend",/wiki/%D8%A2%D8%AE%D8%B1
1,آخر,"last, final","هاي آخر مرّة بستنّاك.
hāy ʔāḵer marra bastannāk
This is the last time I'm waiting for you.",/wiki/%D8%A2%D8%AE%D8%B1
2,آخر,"last, most recent","مش عارف إيمتى آخر مرّة سمعت هالجملة.
miš ʕāref ʔēmta ʔāḵer marra smeʕt hal-jumle
I don't know when the last time I heard that sentence was.",/wiki/%D8%A2%D8%AE%D8%B1
3,آخر,after all,,/wiki/%D8%A2%D8%AE%D8%B1
4,آخر,at last,,/wiki/%D8%A2%D8%AE%D8%B1
5,آخر,end,,/wiki/%D8%A2%D8%AE%D8%B1
6,آسف,sorry,"انا آسف، نسيت أحكي معك مبارح.
ʔana ʔāsef, nsīt ʔaḥki maʕak mbāreḥ
I'm sorry, I forgot to talk with you yesterday.",/wiki/%D8%A2%D8%B3%D9%81
7,آلاف,"plural of ألف‎ (ʔalf, “thousand”)",,/wiki/%D8%A2%D9%84%D8%A7%D9%81
8,آلة,"machine, device","آلة تصوير
ʔālet taṣwīr
camera",/wiki/%D8%A2%D9%84%D8%A9
9,آلة,"apparatus, instrument",,/wiki/%D8%A2%D9%84%D8%A9
10,أباجور,"shutters, blinds (of a window)",,/wiki/%D8%A3%D8%A8%D8%A7%D8%AC%D9%88%D8%B1
11,أبعد,to move away,"لازم أبعد عن التلفون — هيك عمري ما بعمل إشي.
lāzem ʔabʕed ʕan it-tilfōn — hēk ʕomri mā baʕmal ʔiši
I have to get away from the phone — like this I won't ever get anything done.",/wiki/%D8%A3%D8%A8%D8%B9%D8%AF
12,أبعد,"(by extension) to deport, to banish, to exile, to expel",,/wiki/%D8%A3%D8%A8%D8%B9%D8%AF
13,أبيض,white,,/wiki/%D8%A3%D8%A8%D9%8A%D8%B6
14,أثّر,"to affect, to influence (+ في‎)","الدوا مش مأثّر فيه.
id-dawa miš mʔaṯṯer fīh
The medicine doesn't affect him.",
15,أجار,rent,"قديش الأجار؟
ʔaddēš il-ʔajār?
How much is the rent?",/wiki/%D8%A3%D8%AC%D8%A7%D8%B1
16,أجنبي,foreign,"لغة أجنبيّة
luḡa ʔajnabiyye
foreign language",/wiki/%D8%A3%D8%AC%D9%86%D8%A8%D9%8A
17,أجنبي,foreigner,,/wiki/%D8%A3%D8%AC%D9%86%D8%A8%D9%8A
18,أجّل,"to postpone, to put off","كان لازم يأجّلو العرس.
kān lāzem yʔajjelu l-ʕoros.
They had to postpone the wedding.
خلّينا نأجّل هالموضوع ليوم تاني.
ḵallīna nʔajjel hal-mauḍūʕ la-yōm tāni.
Let's put off this subject for another day.",
19,أحمر,red,"الصليب الأحمر
iṣ-ṣalib il-ʔaḥmar
the Red Cross",/wiki/%D8%A3%D8%AD%D9%85%D8%B1
20,أخد,to take,"إمّي أخدت معها الأكل لستّي.
ʔimmi ʔaḵdat maʕha il-ʔakl la-sitti
My mother took the food for my grandmother with her.
لازم ناخد تكسي لأنّه السيّارة مع مرتي
lāzem nāḵod taksi laʔinno is-sayyāra maʕ marti
We have to take a taxi because my wife has the car.
خد شمال من الإشارة وبعدين ضلّ دغري.
ḵod šmāl min il-ʔišāra w-baʕdēn ḍall duḡri
Take a left at the traffic light (lit. signal), then keep (going) straight.
برافو حبيبتي، أخدتي القرار الصحّ.
brāvo ḥabībti, ʔaḵadti il-qarār iṣ-ṣaḥḥ
Bravo my dear, you made (lit. took) the right decision.",/wiki/%D8%A3%D8%AE%D8%AF
21,أخد,to get,"أحمد أخد الكتاب من صاحبه.
ʔaḥmad ʔaḵad li-ktāb min ṣāḥbo
Ahmad got the book from his friend.",/wiki/%D8%A3%D8%AE%D8%AF
22,أخضر,green,"الخطّ الأخضر
il-ḵaṭṭ il-ʔaḵḍar
the Green Line",/wiki/%D8%A3%D8%AE%D8%B6%D8%B1
23,أدنى,"lower, lowest, minimum","الحدّ الأدنى للدفع خمسين شيكل.
il-ḥadd il-ʔadna lad-dafeʔ ḵamsīn šēkel
The minimum payment is fifty shekels.
The minimum limit for payment is fifty shekels.",/wiki/%D8%A3%D8%AF%D9%86%D9%89
24,أدنى,"nearer, nearest",,/wiki/%D8%A3%D8%AF%D9%86%D9%89
25,أرجل,to smoke argileh,"شو رايك أروح عندك ومرّة تانية منأرجل؟
šu rāyak ʔarūḥ ʕindak w-marra tānye minʔargel
What do you say I come over to your place and we smoke argileh at another time?",/wiki/%D8%A3%D8%B1%D8%AC%D9%84
26,أرجيلة,"narghile, hookah, water pipe","بتشرب أرجيلة؟
btišrab ʔargīle
Do you smoke hookah?",/wiki/%D8%A3%D8%B1%D8%AC%D9%8A%D9%84%D8%A9
27,أرض,"land, terrain",,/wiki/%D8%A3%D8%B1%D8%B6
28,أرض,"ground, floor","لقيت ميّتين شيكل عالأرض.
laʔēt miyytēn šēkel ʕal-ʔarḍ
I found two hundred shekels on the ground.",/wiki/%D8%A3%D8%B1%D8%B6
29,أرض,Earth,,/wiki/%D8%A3%D8%B1%D8%B6
30,أرمني,Armenian,,/wiki/%D8%A3%D8%B1%D9%85%D9%86%D9%8A
31,أرمني,Armenian,,/wiki/%D8%A3%D8%B1%D9%85%D9%86%D9%8A
32,أرنب,rabbit,"أرنب بري
ʔarnab barri
hare",/wiki/%D8%A3%D8%B1%D9%86%D8%A8
33,أزرق,blue,,/wiki/%D8%A3%D8%B2%D8%B1%D9%82
34,أزمة,crisis,,/wiki/%D8%A3%D8%B2%D9%85%D8%A9
35,أزمة,traffic,,/wiki/%D8%A3%D8%B2%D9%85%D8%A9
36,أساس,"basis, foundation (literal and figurative)","على أساس إنّ
ʔala ʔasās inn
on the basis that..., on the condition that...",/wiki/%D8%A3%D8%B3%D8%A7%D8%B3
37,أسبوع,week,"آخر الأسبوع
ʔāḵer il-ʔusbūʕ
the weekend",/wiki/%D8%A3%D8%B3%D8%A8%D9%88%D8%B9
38,أستاذ,teacher,,/wiki/%D8%A3%D8%B3%D8%AA%D8%A7%D8%B0
39,أستاذ,"professor, lecturer",,/wiki/%D8%A3%D8%B3%D8%AA%D8%A7%D8%B0
40,أسد,lion,,/wiki/%D8%A3%D8%B3%D8%AF
41,أسد,(astrology) Leo,,/wiki/%D8%A3%D8%B3%D8%AF
42,أسفل,(in places names) lower,"الجليل الأسفل
il-jalīl il-ʔasfal
Lower Galilee
الناصرة السفلى
in-nāṣre s-sufla
Upper Nazareth",/wiki/%D8%A3%D8%B3%D9%81%D9%84
43,أسفل,"under, bottom","رقم التلفون بكون مكتوب أسفل الصفحة.
raqam it-tilfōn bikūn maktūb ʔasfal iṣ-ṣafḥa
The phone number is written at the bottom of the page.",/wiki/%D8%A3%D8%B3%D9%81%D9%84
44,أسود,black,,/wiki/%D8%A3%D8%B3%D9%88%D8%AF
45,أشهر,"plural of شهر‎ (šahr, “month”)",,/wiki/%D8%A3%D8%B4%D9%87%D8%B1
46,أشّر,"to indicate, to point to, to hint to",,
47,أشّر,"to signal, to flag down","إجى الباص وأشّرتله.
ʔija l-bāṣ w ʔaššart-illo.
The bus came and I signaled to it.",
48,أشّر,to peel,,
49,أصبع,finger,,/wiki/%D8%A3%D8%B5%D8%A8%D8%B9
50,أصبع,"key (computer, piano etc.)",,/wiki/%D8%A3%D8%B5%D8%A8%D8%B9
51,أصبع,tube,,/wiki/%D8%A3%D8%B5%D8%A8%D8%B9
52,أصفر,yellow,,/wiki/%D8%A3%D8%B5%D9%81%D8%B1
53,أضفر,(anatomy) nail,,/wiki/%D8%A3%D8%B6%D9%81%D8%B1
54,أعلى,"elative degree of عالي‎ (ʕāli): higher, highest, maximum","الحدّ الأعلى للسرعة ستّين كيلومتر بالساعة.
il-ḥadd il-ʔaʕla las-surʕa sittīn kīlomitr bis-sāʕa
The maximum speed limit is sixty kilometers per hour.",/wiki/%D8%A3%D8%B9%D9%84%D9%89
55,أعلى,(in places names) upper,"الجليل الأعلى
il-jalīl il-ʔaʕla
Upper Galilee
الناصرة العليا
in-nāṣre l-ʕulya
Upper Nazareth",/wiki/%D8%A3%D8%B9%D9%84%D9%89
56,أغلب,most (the majority of),,/wiki/%D8%A3%D8%BA%D9%84%D8%A8
57,أغلب,(by extension) the most likely scenario,"همّه الأغلب بتأخّرو، لإنّه فيه أزمة كتير بالطريق من نابلس.
homme il-ʔaḡlab bitʔaḵḵru, laʔinno fīh ʔazme ktīr biṭ-ṭarīʔ min Nāblis.
They will (the) most likely be late, because there's a lot on traffic on the way from Nablus.",/wiki/%D8%A3%D8%BA%D9%84%D8%A8
58,أفكار,"plural of فكرة‎ (fikra, “(a single) idea, thought”)",,/wiki/%D8%A3%D9%81%D9%83%D8%A7%D8%B1
59,أفكار,"plural of فكر‎ (fikr, “idea, thought, notion, belief”): way of thinking, ideology","كلّ اللي أخدو أفكار الشيوعية تخيّب أملهم في النهاية.
kull illi ʔaḵadu ʔafkār ash-shi’uiyye tḵayyab ʔamalhom fin-nihāye
All those who embraced the ideas of socialism were disappointed in the end.",/wiki/%D8%A3%D9%81%D9%83%D8%A7%D8%B1
60,أقصى,"farther, farthest, most distant",,/wiki/%D8%A3%D9%82%D8%B5%D9%89
61,أقصى,maximal,"الحدّ الأقصى
il-ḥadd il-ʔaqṣa
the maximum",/wiki/%D8%A3%D9%82%D8%B5%D9%89
62,أكتر,"elative degree of كتير‎ (ktīr): more, most",,/wiki/%D8%A3%D9%83%D8%AA%D8%B1
63,أكتر,"more, -er; most, -est (used to form elatives of adjectives, that don't have one.)","مجنون أكتر
majnūn ʔaktar
crazier
أكتر واحد مجنون
ʔaktar wāhad majnūn
the craziest one",/wiki/%D8%A3%D9%83%D8%AA%D8%B1
64,أكتر,"elative degree of كتير‎ (ktīr): more, most","أكتر إشي حبيته
ʔaktar ʔiši ḥabbēto
the thing I liked the most",/wiki/%D8%A3%D9%83%D8%AA%D8%B1
65,أكل,to eat,"لقیت الفار ماكل الجبنة.
laʔēt il-fār mākel il-jibne
I found the mouse had eaten the cheese.",/wiki/%D8%A3%D9%83%D9%84
66,أكل,food,,/wiki/%D8%A3%D9%83%D9%84
67,أكل,eating,,/wiki/%D8%A3%D9%83%D9%84
68,أكم,how many (+ من‎),"أكم من بيضة بدك أعمللك؟
ʔakam min bēḍa biddak ʔaʕmel-lak?
How many eggs do you want me to cook for you?",/wiki/%D8%A3%D9%83%D9%85
69,أكم,"a few, some, several (+ من‎)","قلتلّه أكم من مرّة، بس هو ما بوخد كلامي صحّ.
ʔoltillo ʔakam min marra, bas huwwe ma bōḵed kalāmi ṣaḥḥ.
I told him a few times, but he doesn't take me seriously at my word.",/wiki/%D8%A3%D9%83%D9%85
70,أكّد,"(transitive) to confirm, to ensure","لسّا ما أكّدو الأخبار.
lissa ma ʔakkadu l-ʔaḵbār.
They haven't confirmed the news yet.
لازم نأكّد ولادنا إنّه ما يحطّو تمّهم على أي إشي بمكان عامّ.
lāzem nʔakked ūlādna ʔinno mā yḥoṭṭu timmhom ʕala ʔayy ʔiši bi-makān ʕamm.
We must ensure that our children not put their mouth on anything in a public place.",
71,ألهى,to distract (from (+ عن‎)),"ما رح ألهيك عن شغلك اليوم.
mā raḥ ʔalhīk ʕan šuḡlak il-yōm
I won't distract you from your work today.",/wiki/%D8%A3%D9%84%D9%87%D9%89
72,أم,Alternative form of إم‎ (ʔimm),"اللغة الأم
il-luḡa il-ʔumm
native language, mother tongue",/wiki/%D8%A3%D9%85
73,أما,"whereas, as for, but","ألف شيكل ممكن اعطيك — أمّا ألفين، هلا والله ما بقدر.
ʔalf šēkel mumken aʕṭīk, ʔamma ʔalfēn halla walla mā baʔdar.
I can give you a thousand shekels — as for two thousand, I really can't right now.
كل هادا، معليش — أمّا يكذب علي كمان؟
kull hāda, maʕlēš — ʔamma yikzeb ʕalay kamān?
All of this is fine — but that he should lie to me too?",/wiki/%D8%A3%D9%85%D8%A7
74,أما,used to indicate surprise or other strong feelings in an exclamation,"دخلنا جول — أمّا شو جول!
daḵalna gōl — ʔamma šū gōl!
We scored a goal — what a goal!",/wiki/%D8%A3%D9%85%D8%A7
75,أمّن,"to insure, to secure, to safeguard","سيّارتك مأمّنة؟
sayyārtak mʔammane?
Is your car insured?",
76,أنعم,"(formal) to confer favour, to bestow favour","الله ينعم عليك!
ʔaḷḷa yinʕim ʕalēk!
May Good give you pleasure! (response to نعيما‎ (naʕīman))",/wiki/%D8%A3%D9%86%D8%B9%D9%85
77,أنعم,elative degree of ناعم‎ (nāʕem): softer,,/wiki/%D8%A3%D9%86%D8%B9%D9%85
78,أهان,"to insult, to offend","ما كنت بدي اهينك.
ma kunt biddī ʔahīnak
I didn't want to offend you.",/wiki/%D8%A3%D9%87%D8%A7%D9%86
79,أو,or,,/wiki/%D8%A3%D9%88
80,أو,"or (mutually exclusive, when used together with إما‎ (ʔimma))","إما بتدفع كاش أو بالكرت.
ʔimma btidfaʕ kāš ʔaw bil-kart
Either you pay cash or by card.",/wiki/%D8%A3%D9%88
81,أوضة,room,,/wiki/%D8%A3%D9%88%D8%B6%D8%A9
82,أوضة,room,"أوضة النوم
ʔōḍt in-nōm
bedroom
أوضة الصفرة
ʔōḍt iṣ-ṣufra
dining room",/wiki/%D8%A3%D9%88%D8%B6%D8%A9
83,أول,first,"كيف كان أوّل يوم مدرسة؟
kīf kān ʔawwal yōm madrase
How was the first day of school?",/wiki/%D8%A3%D9%88%D9%84
84,أول,(+ ما‎) as soon as,,/wiki/%D8%A3%D9%88%D9%84
85,أول,"beginning, start",,/wiki/%D8%A3%D9%88%D9%84
86,أيّام,"plural of يوم‎ (yōm, “day”)",,
87,أَكْزَخَانة,pharmacy,"بقى عنده أكزخانة يشتغل فيها.
baʔa ʕindo ʔakzaḵāne yištḡel fīha.",
88,إجا,to come,,/wiki/%D8%A5%D8%AC%D8%A7
89,إجا,to arrive,,/wiki/%D8%A5%D8%AC%D8%A7
90,إجا,to come,"فيه حدا جاي غيري؟
fīh ḥada jāy ḡēri
Is anyone coming aside from me?
هو دايمًا بيجي عالوقت المناسب.
huwwe dāyman bīji ʕal-waʔt li-mnāseb
He always comes at the appropriate time.
إجى الجيش بقوّة عيسكريّة كبيرة.
ʔija l-jēš bi-ʔuwwa ʕaskariyye kbīre
The army came with a lot of (lit. big) military power.
إجت شويّة قهوة على قميصي.
ʔijat šwayyet ʔahwe ʕala ʔamīṣti
A little coffee got on (lit. came to) my shirt.
تعال عندي (لعندي) نحكي شويّ عن الموضوع.
taʕāl ʕindi (la-ʕindi) niḥki šwayy ʕan il-mōḍūʕ
Come over to my place to talk a bit about the issue.",/wiki/%D8%A5%D8%AC%D8%A7
91,إجا,(by extension) to arrive,"من أوّل ما إجيت وإنتي بتحطّي مكياج.
min ʔawwal mā ʔijīt w ʔinti bitḥoṭṭi mikyāj
You've been putting on makeup from the moment I arrived.
Since as soon as I arrived you're putting makeup.",/wiki/%D8%A5%D8%AC%D8%A7
92,إجا,"(+ ل‎) to come up to, to approach","إجتلي وطلبت منّي أعملّها معروف.
ʔijat-li w-ṭalbat minni ʔaʕmil-lha maʕrūf
She came up to me and asked me to do her a favor.",/wiki/%D8%A5%D8%AC%D8%A7
93,إجا,"(by extension) to get, to receive (with recipient as direct object)","إجاني كتير تلفونات من عيلتي اليوم.
ʔijāni ktīr telefōnāt min ʕēlti l-yōm
I got a lot of calls from my family today.
إجتني فرصة أروح أدرس طبّ في بريطانيا.
ʔijatni furṣa ʔarūḥ ʔadros ṭibb fi brīṭānya
I got an opportunity to go study medicine in the UK.",/wiki/%D8%A5%D8%AC%D8%A7
94,إجا,(by extension) (+ في‎) to fit (in a space),"ولا يمكن هالخزانة تيجي بالغرفة.
wala yumken hāl-ḵazāne tīji bil-ḡorfe
There's no way this wardrobe will fit in the room.",/wiki/%D8%A5%D8%AC%D8%A7
95,إجا,(by extension) (+ على‎) to fit (of clothes),"للأسف البنطلون ما بيجي علي (على قدّي) منيح.
lil-ʔasaf il-banṭalōn ma bīji ʕalay (ʕala ʔaddi) mnīḥ
Unfortunately the pants don't fit me well.",/wiki/%D8%A5%D8%AC%D8%A7
96,إجا عالوجع,"to come right on time, with perfect timing, etc.","مبارح جوزي فاجأني بسفرة عاليونان — عن جد إجا عالوجع․
mbāreḥ jōzi fājaʔni bi-safra ʕal-yūnān — ʕan jadd ʔija ʕal-wajaʕ
Yesterday my husband surprised me with a trip to Greece — it really came right on time.",/wiki/%D8%A5%D8%AC%D8%A7_%D8%B9%D8%A7%D9%84%D9%88%D8%AC%D8%B9
97,إجا يكحّلها عماها,to make matters worse,"عشان أوفّر مصاري، جبت صاحبي يصلّحلي التلّاجة — بس إجا يكحّلها عماها․
ʕašān ʔawaffer maṣāri jibt ṣāhbi yṣalleḥ-li it-tallāje bas ʔija ykaḥḥelha ʕamāha
To save money, I brought my friend to fix the fridge for me — but he only made matters worse.",
98,إذا,"if, whether","إسأله إذا المدير موجود.
ʔisʔalo ʔiza l-mudīr mawjūd
Ask him if the manager is there.
ما بعرف إذا برجع ولّا لأ.
ma baʕref ʔiza birjaʕ willa laʔ
I don't know whether he's coming back or not.
إذا رجع بكير، بقلّك.
ʔiza rijeʕ bakkīr, baʔul-lak
If he gets back early, I'll tell you.",/wiki/%D8%A5%D8%B0%D8%A7
99,إذا,"so, then, therefore",,/wiki/%D8%A5%D8%B0%D8%A7
100,إذن,permission,"أخدت إذن من أهلك عشان تروح على هالرحلة؟
ʔaḵadt ʔizn ʕašān trūḥ ʕala hār-riḥle
Did you get permission from your parents to go on the trip?",/wiki/%D8%A5%D8%B0%D9%86
101,إسلام,Islam,,/wiki/%D8%A5%D8%B3%D9%84%D8%A7%D9%85
102,إسلام,Muslims (collective),"الإسلام بصومو في شهر رمضان.
il-ʔislām biṣūmu fi šahr ramaḍān.
Muslims fast in the month of Ramadan.",/wiki/%D8%A5%D8%B3%D9%84%D8%A7%D9%85
103,إشي,thing,,/wiki/%D8%A5%D8%B4%D9%8A
104,إشي,something; anything,,/wiki/%D8%A5%D8%B4%D9%8A
105,إشي,some (... some),"إشي ضلّو، إشي راحو
ʔiši ḍallu, ʔiši rāḥu
Some stayed, some left",/wiki/%D8%A5%D8%B4%D9%8A
106,إلـ,"to; for (detached version of the indirect object suffix ـلـ‎ (-l-), used for emphasis)","كتب إلي، مش إلك.
katab ʔili, miš ʔilak.
He wrote to me, not to you.",
107,إلـ,"belonging to (mine, yours etc.)","هالكتاب إلك.
hāl-kitāb ʔilak
This book is yours.
هو صاحب إله.
huwwe ṣāḥeb ʔilo
He's a friend of his.",
108,إلـ,(by extension) to have,"إلي أخ وأخت.
ʔili ʔaḵḵ w-ʔuẖt
I have a brother and sister.
Mine are a brother and a sister.",
109,إلّا,"unless, if not",,
110,إلّا,"(after negation) except, only",,
111,إلّا,(telling time) to,"الساعة خمسة إلا تلت.
is-sāʕa ḵamse ʔilla tult
It's twenty to three.",
112,إلّا,"and there, lo and behold",,
113,إمّا,"either (used together with أو‎ (ʔaw, “or”))","إما بتدفع أجار البيت أو بترحل.
ʔimma btidfaʕ ʔajār il-bēt ʔaw btirḥal
Either you pay the rent or you get out.",
114,إن,if (followed by a past tense verb),"إن جيت بكرة، جيبلي معك جاكيت.
ʔin jīt bukra jīb-li maʕak jākēt
If you come tomorrow, bring me a jacket.
If you come tomorrow, bring for me a jacket with you.",/wiki/%D8%A5%D9%86
115,إنكنّـ,if (followed by a suffix pronoun),"بدي أعرف إنكنه فاضي بكرة.
biddi ʔaʕref ʔinkann-o fāḍi bukra
I wan't to know if he's free tomorrow.",
116,إنّـ,that (followed by a suffix pronoun),,
117,إيد,hand,"هو دايما بنسى يغسّل إيديه.
huwwe dāyman binsa yḡassel ʔīdēh
He always forgets to wash his hands.",
118,إيد,arm,,
119,إيد,(by extension) handle,,
120,احتاج,"to need, to require","أخيرًا أخدنا الإجازة اللي كننا كتير محتاجينها الصيف الماضي
ʔaḵīran ʔaḵadna il-ʔijāze lli kunna ktīr miḥtājīin-ha iṣ-ṣēf il-māḍi
We finally took the vacation we were really needing last summer.",/wiki/%D8%A7%D8%AD%D8%AA%D8%A7%D8%AC
121,احتياط,precaution,"خلّينا نعمل نسخة تانية للاحتياط.
ḵallīna niʕmil nusḵa tānye lil-iḥtiyāṭ
Let's make a second copy just in case (lit. for the precaution).
ماما أخدت احتياطها وعملت أكل زيادة بحالة إنّه إجو ناس أكتر.
māmā ʔaḵdat iḥtiyāṭha w-ʕimlat ʔakl zyāde bi-ḥāle ʔinno ʔiju nās aktar
Mom took precautions and made extra food in case more people come.",/wiki/%D8%A7%D8%AD%D8%AA%D9%8A%D8%A7%D8%B7
122,احتياط,prudence,,/wiki/%D8%A7%D8%AD%D8%AA%D9%8A%D8%A7%D8%B7
123,احتياط,"precaution, care, caution, wariness",,/wiki/%D8%A7%D8%AD%D8%AA%D9%8A%D8%A7%D8%B7
124,احمرّ,"to turn red, to redden",,
125,احمرّ,(by extension) to blush,"هي احمرّت من الخجل.
hiyye iḥmarrat min il-ḵajal
She blushed out of embarrassment.",
126,احمرّ,(by extension) to get a sunburn,,
127,اختار,to choose,"تطلّع على كلّ أنواع هالبوظة — مش عارف شو بدّي أختار.
itṭallaʕ ʕala kull ʔanwāʕ hāl-būẓa — miš ʕāref šu biddi ʔaḵtār
Look at all these ice cream flavors — I don't know what to choose.
إذا اخترتو تروحو على هالرحلة هادا إشي برجعلكم.
ʔiza iḵtartu trūḥu ʕala hāl-raḥle hāda ʔiši birjaʕ-ilkom
If you choose to go on the trip, that's up to you.",/wiki/%D8%A7%D8%AE%D8%AA%D8%A7%D8%B1
128,اخترع,to invent,"اخترعو رمز سرّي يبعتولكم ايّاه أولادكم لمّا يحسّو حالهم بمواقف مش مريحة.
iḵtirʕu ramz sirri yibʕatū-lkom iyyāh ūlādkom lamma yḥessu ḥālhom bi-mawāʔef miš murīḥa
Invent a secret message for your kids to send you when they feel themselves in uncomfortable situations.",/wiki/%D8%A7%D8%AE%D8%AA%D8%B1%D8%B9
129,اختفى,"to vanish, to disappear","تلفوني كان هون واختفى.
telfōni kān hōn w-iḵtafa.
My phone was here and now it's gone.
My phone was here and it disappeared.",/wiki/%D8%A7%D8%AE%D8%AA%D9%81%D9%89
130,ارتاح,"to rest, to relax",,/wiki/%D8%A7%D8%B1%D8%AA%D8%A7%D8%AD
131,ارتاح,to be at ease or comfortable with something,"انا بالمرّة ما ارتحت.
ana bil-marra mā rtaḥt
I wasn't comfortable at all.
خبّرني إذا فيه أي إشي ما ارتحتيله.
ḵabbirni ʔiza fīh ʔayy ʔiši mā rtaḥtīlo
Let me know if there's anything you're not comfortable with.",/wiki/%D8%A7%D8%B1%D8%AA%D8%A7%D8%AD
132,استأجر,"to rent, to lease","بدّي استأجر غرفة.
biddi staʔjer ḡorfe.
I want to rent a room.",/wiki/%D8%A7%D8%B3%D8%AA%D8%A3%D8%AC%D8%B1
133,استحى,"to be shy, to be ashamed, to be embarrassed","استحيت أسأله.
istaḥēt asʔalo.
I was embarrassed to ask him.",/wiki/%D8%A7%D8%B3%D8%AA%D8%AD%D9%89
134,استخدم,to use,"هو مش عارف يستخدم الكمبيوتر.
hū miš ʕāref yistaḵdem il-kambyūter.
He doesn't know how to use the computer.",/wiki/%D8%A7%D8%B3%D8%AA%D8%AE%D8%AF%D9%85
135,استراحة,"rest, break, intermission","لمّا بدرس للامتحانات، بالعادة باخد استراحة واحدة بس لمدة نصّ ساعة.
lamma badros lil-imtiḥānāt bil-ʕāda bāḵod istirāḥa wāḥde bas la-moddet nuṣṣ sāʕa
When I study for exams, I usually just take one half-hour break.",/wiki/%D8%A7%D8%B3%D8%AA%D8%B1%D8%A7%D8%AD%D8%A9
136,استرخى,"to slacken, to loosen, to become limp",,/wiki/%D8%A7%D8%B3%D8%AA%D8%B1%D8%AE%D9%89
137,استرخى,"to relax, to loosen up","بدي أضلّ بالبيت وأسترخي.
biddi ʔaḍall bil-bēt w ʔastarḵi.
I want to stay home and relax.",/wiki/%D8%A7%D8%B3%D8%AA%D8%B1%D8%AE%D9%89
138,استشار,"to consult, to seek someone's advice","بعد ما استشرت المحامي، قرّرت إنّي ما أستثمر بالمشروع لأنّه القانون ما بضمنلي حقّي.
baʕd mā istašart il-muḥāmi qarrart ʔinni mā ʔastaṯmer bil-mašrūʕ laʔinno il-qānūn mā biḍman-li haʔʔi
After I consulted the attorney, I decided not to invest in the project, because the law doesn't guarantee my rights.",/wiki/%D8%A7%D8%B3%D8%AA%D8%B4%D8%A7%D8%B1
139,استعار,to borrow,"استعرت منّه أكمّن كتاب
istaʕart minno ʕakammin kitāb
I borrowed several books from him.",/wiki/%D8%A7%D8%B3%D8%AA%D8%B9%D8%A7%D8%B1
140,استعمل,to use,"استعملنا كلّ الطرق.
istaʕmalna kull iṭ-ṭoroʔ.
We employed every method.",/wiki/%D8%A7%D8%B3%D8%AA%D8%B9%D9%85%D9%84
141,استغرب,"to find (something) weird, strange, odd, unusual, funny","بستغرب منّك كيف بتيجي هون مرّة تانية.
bastaḡreb minnak kīf btījī hōn marra tānye
I can't understand how you could come here again.
I find it strange from you how you come here a second time.",/wiki/%D8%A7%D8%B3%D8%AA%D8%BA%D8%B1%D8%A8
142,استغل,"to take advantage, to exploit","بيستغلّو العمّال
bistaḡellu il-ʕummāl
They exploit the workers.",/wiki/%D8%A7%D8%B3%D8%AA%D8%BA%D9%84
143,استغنى,"to do, manage, get along without","بتقدر تستغني عنه؟
btiʔdar tistaḡni ʕano
Can you manage without him?",/wiki/%D8%A7%D8%B3%D8%AA%D8%BA%D9%86%D9%89
144,استفاد,"to benefit or profit from, to make use of","بصراحة بستفيد كتير من محاضراته.
bi-ṣarāḥa bastafīd ktīr min muḥāḍarāto
Honestly, I get a lot out of his lectures.",/wiki/%D8%A7%D8%B3%D8%AA%D9%81%D8%A7%D8%AF
145,استقبل,to receive,"استقبلني في مكتبه.
istaʔbalni fī maktabo
He received me in his office.",/wiki/%D8%A7%D8%B3%D8%AA%D9%82%D8%A8%D9%84
146,استنّى,to wait,"خلّينا نستنّى نشوف شو بتحكي المسّ
ḵallīna nistanna nšūf šū btiḥki il-miss
Let's wait to see what the teacher says.",
147,استورد,to import,"منستورد بضاعتنا من الخارج.
mnistawradd bḍāʔatna min il-ḵārej
We import our goods from abroad.",/wiki/%D8%A7%D8%B3%D8%AA%D9%88%D8%B1%D8%AF
148,اسم,name,"اسم العيلة
ʔism il-ʕēle
surname, family name
اسم الشخص
ʔism iš-šaḵṣ
first name
شو اسمك؟
šu ʔismak?
What's your name?
شو الاسم الكريم؟
šu l-ʔism il-karīm?
What's your noble name?",/wiki/%D8%A7%D8%B3%D9%85
149,اسم,noun,,/wiki/%D8%A7%D8%B3%D9%85
150,اسم,name,"شسمك ؟
šismik
What's your name?",/wiki/%D8%A7%D8%B3%D9%85
151,اسم,noun,,/wiki/%D8%A7%D8%B3%D9%85
152,اسم,title,"ما ختارش اسم باهي لكتابه
mā ḵtāriš ʔism bāhi liktābu
He didn't choose a good title for his book",/wiki/%D8%A7%D8%B3%D9%85
153,اسم,first name,,/wiki/%D8%A7%D8%B3%D9%85
154,اسم,unequal,,/wiki/%D8%A7%D8%B3%D9%85
155,اسم,uneven,,/wiki/%D8%A7%D8%B3%D9%85
156,اسم,dissimilar,,/wiki/%D8%A7%D8%B3%D9%85
157,اسم,unusual,,/wiki/%D8%A7%D8%B3%D9%85
158,اسمر,"to get dark, to tan","كنت في البحر واسمرّيت كتير.
kunt fi-l-baḥr w-ismarrēt ktīr
I was at the sea [beach] and I got really tanned.",/wiki/%D8%A7%D8%B3%D9%85%D8%B1
159,اشترك,to subscribe,"ما تنسو تشتركو بالقناة.
mā tinsu tištirku bil-qanā.
Don't forget to subscribe to the channel.",/wiki/%D8%A7%D8%B4%D8%AA%D8%B1%D9%83
